{"coordinates":"right-handed-y-up","elements":[],"groups":[],"parts":[{"axialChamferMm":0.05,"color":"#aeb8c2","creaseAngle":0.5235987755982988,"evidence":{"source":"morphloom.spur-gear/0.1; zero profile shift; radial root connector, not manufacturing trochoid or approved tolerances","status":"authored"},"geometry":{"boreDiameterMm":6,"faceWidthMm":8,"moduleMm":1,"op":"spur-gear","pressureAngleDeg":20,"toothCount":24},"id":"spur_gear","locked":false,"material":{"metalness":0.9,"roughness":0.52,"surface":{"channels":"roughness-only","finish":"brushed-metal","repeat":[8,8]}},"name":"External involute spur gear · radial root approximation","position":[0,0,0],"rotation":[0,0,0],"scale":[1,1,1],"shape":"assembly-geometry","uvScale":100,"visible":true}],"regions":[],"schema":"morphloom.elements/0.6","seed":42,"selection":["spur_gear"],"units":"mm"}